585233000000000000, seven minutes in and im still tryna figure out who tf erica mena thinks she is 
585236000000000000," Oh no we can't get married yet but I'm gon do this commitment ceremony  and change my last name. 

K."
585239000000000000,"""Go back to L.A. with your dog."""
585243000000000000,And her mother is defending her...
585260000000000000,"Missed 20 minutes of my show. Thanks, Dish."
585262000000000000,"One of the things I appreciate about my old job, is that it got me into the habit of setting daily goals."
585276000000000000,"In ""American Hustle,"" Bradley Cooper looks like Drake and it's weird."
585591000000000000," I'm like ""when did this happen?"" Lol"
585593000000000000,"So, I'm getting this job next week. Mmkay?"
585594000000000000,I'm too excited to run away Friday 
585858000000000000,Christopher Keelty gets it. This cartoon wld be even funnier if it weren't so accurate.
585867000000000000,I always strongly hated the Ne-Yo version.
585873000000000000, They've essentially made it illegal to seek safety away from police who are demonstrably a threat to Black survival. Conv‚Ä¶
585875000000000000, After seein the 2nd slightly less fast n furious trailer for the NWA movie I can confirm its bout to be 
585885000000000000,Did this update and I see no brown emojis 
585947000000000000,"From now on,  this is Chris Brown."
585976000000000000,Just tweet normal business shit.
586260000000000000,Know what you are paying for! Ask questions before handing over your money! The price of Simply Lemonade has shot up. Fuck ‚Ä¶
586357000000000000,"Hey guys, apple App Store has a 30 day free trial of HBO Now."
586492000000000000, a good number?
586495000000000000, oh lol
586923000000000000," Here's the full Kendrick Lamar reference verse for Kanye West's ""All Day"" "
587415000000000000,"""Oh, my goodness. She's looking fine.""-Nev of ""Catfish"""
587677000000000000,"""Did you get my text?"" What is that? I can be reached on my Yahoo Messenger."
587679000000000000," RT for Jarule &amp; Ashanti
FAV for Fab &amp; Lil Mo"
587768000000000000,"""Oh, God. He shot me, he shot me. And I didn't do shit."" "
587998000000000000," While I'm happy that the teachers in Atlanta are being given a more humane sentence, the entire ordeal is ridiculous "
588000000000000000,I see we're only going to talk about  today.
588001000000000000,Wish I could find this tumblr post saying it's understandable if you get confused on the who's who of black people getting killed by...
588002000000000000,"Law enforcement, because it happens so often. "
588007000000000000," because it speaks to a bigger issue; standardized tests. They were wrong. But, what caused them to be wrong."
588008000000000000,"Those were the good days, Wiz."
588009000000000000, usually
588051000000000000,I hate these follow buttons on this app
588154000000000000,Busy day tomorrow.
588157000000000000,I remember thinking MIA was going to give birth on stage.
588160000000000000,That's us women : She readin so damn much into a text.
588165000000000000,we shall overcome
588166000000000000, She's ruining this before it even starts. SMH 
588167000000000000,"""You're gonna figure it out."" Saves lives "
588168000000000000,Go home Roger #BeingMaryJane
588172000000000000,The only consolation is getting Bill back home.
588173000000000000,I feel it in my spirit that Ester Dean has so much money and I'm so happy for her.
588183000000000000,me too and I don't even know what that is.
588184000000000000, nice!
588215000000000000," If you aren't doing it for Lil' Saint, maybe you shouldn't be doing it."
588392000000000000,"Job Fair Tomorrow, Atlanta "
588393000000000000,"But, in the meantime someone needs to pay me WELL."
588493000000000000, Peter Gunz looks like an extra from a Dave Hollister video.
589173000000000000,"When I care, I truly care."
589263000000000000,I just want my food 
589464000000000000," ""Yo Fams step outside right quick!"" "
589467000000000000,"That article is so real. The most wealthy people, don't even ""look"" wealthy."
589468000000000000,"I'm in such a good mood. I haven't felt this way in a really long time, I feel so happy."
589469000000000000," when they told ben affleck they found something terrible in his past u know he immediately thought ""gigli"""
589519000000000000,My folks! We had a great time last night at the Emmy FYC panel.
589866000000000000, read it again . 
589913000000000000, Mystery ailment kills victims within hours; 18 dead. .
589915000000000000," first off, Black Thor would have dreads my nigga."
589916000000000000,Because of them we can. 
589929000000000000,Love it!
589944000000000000,I'm oddly obsessed with aliens lol 
589945000000000000,Currently attempting to zone out.
590168000000000000,Happy holidaze to those who partake! 
590194000000000000, Did you eat today? Did you have a place to lay your head? If so... Your problems might not be real problems.
590217000000000000," Today in 1999, 13 people are killed at Columbine, Jay-Z, Damon Dash, DMX, Meth, Red donate Hard Knock Life tour money htt‚Ä¶"
590302000000000000,I really had to pull out an ice pack for this migraine
590306000000000000,Joseline is suspended for how many episodes?
590315000000000000,"According to reality shows, when a man wants to be an asshole, he shows up to your photo shoot."
590327000000000000,"Yep, still happy."
590335000000000000,My niece is so cool 
590550000000000000,It's not hard to see why someone dislikes Floyd.....he's a piece of shit outside the ring but a God inside
590588000000000000,
590589000000000000,Super blown that my getaway may not happen 
590696000000000000, Bae leave me &amp; my kid for a teenager I'm gonna fight her mama every day til she turns 18
590697000000000000,yass!!!
590718000000000000,"See ya later, bye!"
590719000000000000,l they're so annoying. I wish I could swap out the raisins for dried cranberries 
590720000000000000,"But, I won't."
590835000000000000, true!
590996000000000000,Just caught my first tan of the year
591000000000000000,Tell your preacher stay off Rap Genius looking for material.
591021000000000000, tried the chicken sandwich yesterday
591028000000000000," the sandwich was spicy, I just B447should've B450loser attention and realized there was nacho cheese on it∑ it was too much"
591052000000000000, I need a beach in my life very soon 
591445000000000000,Raymond' child star commits suicide at 19  via @USATODAY
591563000000000000,LRT is like a sci-du movie.
591753000000000000,me too! I haven't watched that show in so long but I had the sad face this morning lol
591769000000000000, girl...
591770000000000000,"Now, I'm just sitting here like: üò≥. But hey, walk in your truth."
591771000000000000,this shit is wild.
591772000000000000,"Looking at Bruce's baby pics, all I see is Brody."
591773000000000000,"Hey, Brody."
591777000000000000,Bruce initially began transitioning in in the 80's
591782000000000000,Some of you need to chill.
591785000000000000,Brody so fine.
591786000000000000,"If I'm going off of the little bit the TV show displays, Kendall always seemed to have more Jenner in her and that's why she's dope imo."
591787000000000000,"Kylie's always been a fast ass, but that speaks more to her parenting than her."
591788000000000000,fuck you Perez no one asked me to comment ....and I'm sitting with Bruce now watching this show so let's keep ‚Ä¶
591790000000000000,"BruceJenner's story is to be respected whether the public eye ""gets it"" or not. Jenner's self identity is the only valid on‚Ä¶"
591791000000000000,"Yes, Bruce! You better speak on violence against Black Trans Women."
591792000000000000,I'd really like to go make some food tho... 20 more minutes 
591998000000000000,My phone is being... Fun. 3 hour delay on texts
591999000000000000,This earthquake
592163000000000000, Starlight Drive In
592166000000000000,I like the blonde!
592373000000000000,"21 years ago today ,OutKast released their debut album 'Southernplayalisticadillacmuzik'. #HappyAnniversary"
592542000000000000,This. Sucks.
592551000000000000,Jay Z hopped on Twitter defending #Tidal like... 
592819000000000000," nah, Matthew is incredibly country."
592823000000000000, So proud to announce that every high school in the U.S. will receive a FREE copy of Selma. Go team Selma! 
592824000000000000,Men from the Nation of Islam stand between the neighborhood people and the police. Baltimo‚Ä¶  http:/‚Ä¶
592825000000000000,"Enough with the ""#Baltimore is burning."" Baltimore burned in 1904. Now, a CVS is on fire. It's almost as if people are h‚Ä¶"
592835000000000000, I love black people
592839000000000000,"This is why Twitter &amp; Social media is so important. Cause at the end of the day, Fox News or CNN, they all talk about blac‚Ä¶"
592845000000000000,"I'm still extremely confused about someone signing a 5 album deal with Kirk. Like, can we look at the track record???"
592846000000000000,I'm going to conduck myself like a lady.
592847000000000000,That shopping scene was very corny.
592848000000000000,I really hope Rasheeda and Kirk's drama is fake.
592849000000000000,What's on my television? 
592850000000000000, I think things are bad enough without you being there. 
592851000000000000,I was so disappointed in that Wendy's sandwich. Waste of calories
592852000000000000,That baby 
592854000000000000, Eve started out with Stevie J and ended up married to a billionaire. WHEN JESUS SAYS YES NOBODY CAN SAY NO.
592862000000000000,I miss my school
592864000000000000, Yo this is all I can think of when I see the picture of that kid in Baltimore in the UPS truck 
592889000000000000,"If, God forbid, someone I love dearly is killed by someone because of their race, don't expect me to call for an end to riots."
592890000000000000,Baltimore accents make my heart smile.
592891000000000000,New Orleans as well.
592908000000000000, This country spent a decade consuming Black #Baltimore's misery as entertainment on TV but now when real people rise up
593162000000000000, Torn x LeToya still goes
593247000000000000,Ciara is so pretty
593426000000000000," Happy birthday to the legendary #DukeEllington. (April 29, 1899 ‚Äì May 24, 1974) "
593444000000000000,I think I'm old. I'm really excited to rent a rug doctor for my apartment
593448000000000000," Dawg, you really don't understand how much ppl are influenced by the media until you talk to somebody without twitter."
593449000000000000,I've been arrested/detained in Bmore. And my arrest was DEFINITELY unfair and brutal...a lot of my cast mates have the 
593454000000000000,I have emoji errors all the time
